{
  "module": "AUTH",
  "schema_version": "1.0.0",
  "generated_at": "2026-09-06T15:56:37.352Z",
  "harvester_version": "1.0.0",
  "rules": [
    {
      "id": "BR-AUTH-001",
      "entity_version": 1,
      "statement": "User Name must satisfy cascade, not empty, minimum length",
      "module": "AUTH",
      "category": "validation",
      "category_evidence": "FluentValidation rule",
      "origin": "IMPLEMENTED",
      "enforced_by": [
        {
          "component": "COMP-AUTH-005",
          "file": "src/Application/Auth/Commands/Login/LoginCommandValidator.cs",
          "line": 12,
          "mechanism": "fluent-validation",
          "expression": "RuleFor(x => x.UserName).Cascade().NotEmpty().MinimumLength()"
        }
      ],
      "requirements": [],
      "features": [],
      "components": [
        "COMP-AUTH-005"
      ],
      "test_cases": [
        "TC-AUTH-003",
        "TC-AUTH-004",
        "TC-AUTH-005",
        "TC-AUTH-006"
      ],
      "coverage": {
        "specified": "NO",
        "implemented": "YES",
        "tested": "PARTIAL",
        "test_count": 4,
        "computed_at": "2026-09-06T15:56:37.352Z"
      },
      "machine": {
        "detector": "fluent-validation",
        "raw": "RuleFor(x => x.UserName).Cascade().NotEmpty().MinimumLength()",
        "symbol": "LoginCommandValidator",
        "git": {
          "state": "COMMITTED",
          "last_commit": "f5788487e25c5e1023b3097d61541cb65a5ebb0f",
          "last_commit_date": "2026-09-02"
        }
      },
      "status": "draft",
      "data_classification": "PUBLIC_SAFE",
      "provenance": {
        "generator": "harvest-rules.mjs",
        "generator_version": "1.0.0",
        "generated_at": "2026-09-06T15:56:37.352Z",
        "confidence": "INFERRED",
        "evidence": [
          {
            "kind": "symbol",
            "ref": "src/Application/Auth/Commands/Login/LoginCommandValidator.cs#LoginCommandValidator",
            "line": 12
          }
        ],
        "notes": "Read out of the enforcement in code. The behaviour is certain; whether it was intended as a business rule is a human judgement."
      },
      "last_verified_commit": "f5788487e25c5e1023b3097d61541cb65a5ebb0f",
      "change_history": []
    },
    {
      "id": "BR-AUTH-002",
      "entity_version": 1,
      "statement": "Password must satisfy not empty",
      "module": "AUTH",
      "category": "validation",
      "category_evidence": "FluentValidation rule",
      "origin": "IMPLEMENTED",
      "enforced_by": [
        {
          "component": "COMP-AUTH-005",
          "file": "src/Application/Auth/Commands/Login/LoginCommandValidator.cs",
          "line": 18,
          "mechanism": "fluent-validation",
          "expression": "RuleFor(x => x.Password).NotEmpty()"
        }
      ],
      "requirements": [],
      "features": [],
      "components": [
        "COMP-AUTH-005"
      ],
      "test_cases": [
        "TC-AUTH-003",
        "TC-AUTH-004",
        "TC-AUTH-005",
        "TC-AUTH-006"
      ],
      "coverage": {
        "specified": "NO",
        "implemented": "YES",
        "tested": "PARTIAL",
        "test_count": 4,
        "computed_at": "2026-09-06T15:56:37.352Z"
      },
      "machine": {
        "detector": "fluent-validation",
        "raw": "RuleFor(x => x.Password).NotEmpty()",
        "symbol": "LoginCommandValidator",
        "git": {
          "state": "COMMITTED",
          "last_commit": "f5788487e25c5e1023b3097d61541cb65a5ebb0f",
          "last_commit_date": "2026-09-02"
        }
      },
      "status": "draft",
      "data_classification": "PUBLIC_SAFE",
      "provenance": {
        "generator": "harvest-rules.mjs",
        "generator_version": "1.0.0",
        "generated_at": "2026-09-06T15:56:37.352Z",
        "confidence": "INFERRED",
        "evidence": [
          {
            "kind": "symbol",
            "ref": "src/Application/Auth/Commands/Login/LoginCommandValidator.cs#LoginCommandValidator",
            "line": 18
          }
        ],
        "notes": "Read out of the enforcement in code. The behaviour is certain; whether it was intended as a business rule is a human judgement."
      },
      "last_verified_commit": "f5788487e25c5e1023b3097d61541cb65a5ebb0f",
      "change_history": []
    },
    {
      "id": "BR-AUTH-003",
      "entity_version": 1,
      "statement": "Refresh Token must satisfy not empty",
      "module": "AUTH",
      "category": "validation",
      "category_evidence": "FluentValidation rule",
      "origin": "IMPLEMENTED",
      "enforced_by": [
        {
          "component": "COMP-AUTH-010",
          "file": "src/Application/Auth/Commands/RefreshAccessToken/RefreshAccessTokenCommandValidator.cs",
          "line": 9,
          "mechanism": "fluent-validation",
          "expression": "RuleFor(x => x.RefreshToken).NotEmpty()"
        }
      ],
      "requirements": [],
      "features": [],
      "components": [
        "COMP-AUTH-010"
      ],
      "test_cases": [
        "TC-AUTH-009",
        "TC-AUTH-010"
      ],
      "coverage": {
        "specified": "NO",
        "implemented": "YES",
        "tested": "PARTIAL",
        "test_count": 2,
        "computed_at": "2026-09-06T15:56:37.352Z"
      },
      "machine": {
        "detector": "fluent-validation",
        "raw": "RuleFor(x => x.RefreshToken).NotEmpty()",
        "symbol": "RefreshAccessTokenCommandValidator",
        "git": {
          "state": "COMMITTED",
          "last_commit": "d7261ed6fdb113a33afe9d8494cdd4b15bbbe4ca",
          "last_commit_date": "2026-08-05"
        }
      },
      "status": "draft",
      "data_classification": "PUBLIC_SAFE",
      "provenance": {
        "generator": "harvest-rules.mjs",
        "generator_version": "1.0.0",
        "generated_at": "2026-09-06T15:56:37.352Z",
        "confidence": "INFERRED",
        "evidence": [
          {
            "kind": "symbol",
            "ref": "src/Application/Auth/Commands/RefreshAccessToken/RefreshAccessTokenCommandValidator.cs#RefreshAccessTokenCommandValidator",
            "line": 9
          }
        ],
        "notes": "Read out of the enforcement in code. The behaviour is certain; whether it was intended as a business rule is a human judgement."
      },
      "last_verified_commit": "d7261ed6fdb113a33afe9d8494cdd4b15bbbe4ca",
      "change_history": []
    },
    {
      "id": "BR-AUTH-004",
      "entity_version": 1,
      "statement": "Email must satisfy not empty, email address",
      "module": "AUTH",
      "category": "validation",
      "category_evidence": "FluentValidation rule",
      "origin": "IMPLEMENTED",
      "enforced_by": [
        {
          "component": "COMP-AUTH-013",
          "file": "src/Application/Auth/Commands/Register/RegisterCommandValidator.cs",
          "line": 9,
          "mechanism": "fluent-validation",
          "expression": "RuleFor(x => x.Email).NotEmpty().EmailAddress()"
        }
      ],
      "requirements": [],
      "features": [],
      "components": [
        "COMP-AUTH-013"
      ],
      "test_cases": [],
      "coverage": {
        "specified": "NO",
        "implemented": "YES",
        "tested": "NOT_FOUND",
        "test_count": 0,
        "computed_at": "2026-09-06T15:56:37.352Z"
      },
      "machine": {
        "detector": "fluent-validation",
        "raw": "RuleFor(x => x.Email).NotEmpty().EmailAddress()",
        "symbol": "RegisterCommandValidator",
        "git": {
          "state": "COMMITTED",
          "last_commit": "e6b48c8a0af5459f3368e0fb1f1b2804ce41efec",
          "last_commit_date": "2026-08-13"
        }
      },
      "status": "draft",
      "data_classification": "PUBLIC_SAFE",
      "provenance": {
        "generator": "harvest-rules.mjs",
        "generator_version": "1.0.0",
        "generated_at": "2026-09-06T15:56:37.352Z",
        "confidence": "INFERRED",
        "evidence": [
          {
            "kind": "symbol",
            "ref": "src/Application/Auth/Commands/Register/RegisterCommandValidator.cs#RegisterCommandValidator",
            "line": 9
          }
        ],
        "notes": "Read out of the enforcement in code. The behaviour is certain; whether it was intended as a business rule is a human judgement."
      },
      "last_verified_commit": "e6b48c8a0af5459f3368e0fb1f1b2804ce41efec",
      "change_history": []
    },
    {
      "id": "BR-AUTH-005",
      "entity_version": 1,
      "statement": "Password must satisfy not empty, minimum length",
      "module": "AUTH",
      "category": "validation",
      "category_evidence": "FluentValidation rule",
      "origin": "IMPLEMENTED",
      "enforced_by": [
        {
          "component": "COMP-AUTH-013",
          "file": "src/Application/Auth/Commands/Register/RegisterCommandValidator.cs",
          "line": 15,
          "mechanism": "fluent-validation",
          "expression": "RuleFor(x => x.Password).NotEmpty().MinimumLength()"
        }
      ],
      "requirements": [],
      "features": [],
      "components": [
        "COMP-AUTH-013"
      ],
      "test_cases": [],
      "coverage": {
        "specified": "NO",
        "implemented": "YES",
        "tested": "NOT_FOUND",
        "test_count": 0,
        "computed_at": "2026-09-06T15:56:37.352Z"
      },
      "machine": {
        "detector": "fluent-validation",
        "raw": "RuleFor(x => x.Password).NotEmpty().MinimumLength()",
        "symbol": "RegisterCommandValidator",
        "git": {
          "state": "COMMITTED",
          "last_commit": "e6b48c8a0af5459f3368e0fb1f1b2804ce41efec",
          "last_commit_date": "2026-08-13"
        }
      },
      "status": "draft",
      "data_classification": "PUBLIC_SAFE",
      "provenance": {
        "generator": "harvest-rules.mjs",
        "generator_version": "1.0.0",
        "generated_at": "2026-09-06T15:56:37.352Z",
        "confidence": "INFERRED",
        "evidence": [
          {
            "kind": "symbol",